{
  "$schema": "https://json-schema.org/draft/2020-12/schema",
  "title": "VN State Delta",
  "type": "object",
  "required": ["scene_id", "character_state_changes", "relationship_changes", "item_changes", "secret_changes", "route_flags", "promises"],
  "properties": {
    "scene_id": { "type": "string" },
    "character_state_changes": { "type": "array", "items": { "type": "object" } },
    "relationship_changes": { "type": "array", "items": { "type": "object" } },
    "item_changes": { "type": "array", "items": { "type": "object" } },
    "secret_changes": { "type": "array", "items": { "type": "object" } },
    "route_flags": { "type": "array", "items": { "type": "object" } },
    "promises": { "type": "array", "items": { "type": "object" } },
    "foreshadow_payoff": { "type": "array", "items": { "type": "object" } },
    "deadline_changes": { "type": "array", "items": { "type": "object" } },
    "memory_entries_to_write": { "type": "array", "items": { "type": "object" } }
  }
}

